{
  "$schema": "../../../../course-catalog.schema.json",
  "schema_version": 1,
  "catalog_id": "niigata-engineering-sis-2025-catalog-v1",
  "profile_id": "niigata-engineering-sis-2025-v1",
  "evidence_status": "transcribed",
  "courses": [
    {
      "id": "sis-common-a-01",
      "course_code": null,
      "name": "総合工学概論",
      "curriculum_area": "faculty_specialized",
      "course_group": "specialized_applied",
      "requirement_code": "A",
      "credits": 2,
      "standard_years": [
        1
      ],
      "terms": [],
      "aliases": [],
      "required_for": [
        "graduation"
      ],
      "source_refs": [
        {
          "document_id": "student_handbook_2025",
          "section": "専門応用 A科目（工学科共通・情報電子分野を含む）",
          "printed_pages": [
            8,
            39
          ],
          "pdf_pages": [
            12,
            43
          ]
        }
      ]
    },
    {
      "id": "sis-common-a-02",
      "course_code": null,
      "name": "総合技術科学演習",
      "curriculum_area": "faculty_specialized",
      "course_group": "specialized_applied",
      "requirement_code": "A",
      "credits": 2,
      "standard_years": [
        1
      ],
      "terms": [],
      "aliases": [],
      "required_for": [
        "graduation"
      ],
      "source_refs": [
        {
          "document_id": "student_handbook_2025",
          "section": "専門応用 A科目（工学科共通・情報電子分野を含む）",
          "printed_pages": [
            8,
            39
          ],
          "pdf_pages": [
            12,
            43
          ]
        }
      ]
    },
    {
      "id": "sis-common-a-03",
      "course_code": null,
      "name": "技術者の心がまえ",
      "curriculum_area": "faculty_specialized",
      "course_group": "specialized_applied",
      "requirement_code": "A",
      "credits": 2,
      "standard_years": [
        1
      ],
      "terms": [],
      "aliases": [],
      "required_for": [
        "graduation"
      ],
      "source_refs": [
        {
          "document_id": "student_handbook_2025",
          "section": "専門応用 A科目（工学科共通・情報電子分野を含む）",
          "printed_pages": [
            8,
            39
          ],
          "pdf_pages": [
            12,
            43
          ]
        }
      ]
    },
    {
      "id": "sis-common-a-04",
      "course_code": null,
      "name": "知的財産概論",
      "curriculum_area": "faculty_specialized",
      "course_group": "specialized_applied",
      "requirement_code": "A",
      "credits": 1,
      "standard_years": [
        1
      ],
      "terms": [],
      "aliases": [],
      "required_for": [
        "graduation"
      ],
      "source_refs": [
        {
          "document_id": "student_handbook_2025",
          "section": "専門応用 A科目（工学科共通・情報電子分野を含む）",
          "printed_pages": [
            8,
            39
          ],
          "pdf_pages": [
            12,
            43
          ]
        }
      ]
    },
    {
      "id": "sis-common-a-05",
      "course_code": null,
      "name": "情報セキュリティ概論",
      "curriculum_area": "faculty_specialized",
      "course_group": "specialized_applied",
      "requirement_code": "A",
      "credits": 1,
      "standard_years": [
        1
      ],
      "terms": [],
      "aliases": [],
      "required_for": [
        "graduation"
      ],
      "source_refs": [
        {
          "document_id": "student_handbook_2025",
          "section": "専門応用 A科目（工学科共通・情報電子分野を含む）",
          "printed_pages": [
            8,
            39
          ],
          "pdf_pages": [
            12,
            43
          ]
        }
      ]
    },
    {
      "id": "sis-common-a-06",
      "course_code": null,
      "name": "国際工学概論",
      "curriculum_area": "faculty_specialized",
      "course_group": "specialized_applied",
      "requirement_code": "A",
      "credits": 1,
      "standard_years": [
        2
      ],
      "terms": [],
      "aliases": [],
      "required_for": [
        "graduation"
      ],
      "source_refs": [
        {
          "document_id": "student_handbook_2025",
          "section": "専門応用 A科目（工学科共通・情報電子分野を含む）",
          "printed_pages": [
            8,
            39
          ],
          "pdf_pages": [
            12,
            43
          ]
        }
      ]
    },
    {
      "id": "sis-common-c-01",
      "course_code": null,
      "name": "職業指導（工）",
      "curriculum_area": "faculty_specialized",
      "course_group": "specialized_applied",
      "requirement_code": "C",
      "credits": 2,
      "standard_years": [
        4
      ],
      "terms": [],
      "aliases": [],
      "required_for": [],
      "source_refs": [
        {
          "document_id": "student_handbook_2025",
          "section": "専門応用 C科目（工学科共通・情報電子分野を含む）",
          "printed_pages": [
            8,
            39
          ],
          "pdf_pages": [
            12,
            43
          ]
        }
      ]
    },
    {
      "id": "sis-common-c-02",
      "course_code": null,
      "name": "創造プロジェクト基礎",
      "curriculum_area": "faculty_specialized",
      "course_group": "specialized_applied",
      "requirement_code": "C",
      "credits": 2,
      "standard_years": [
        1
      ],
      "terms": [],
      "aliases": [],
      "required_for": [],
      "source_refs": [
        {
          "document_id": "student_handbook_2025",
          "section": "専門応用 C科目（工学科共通・情報電子分野を含む）",
          "printed_pages": [
            8,
            39
          ],
          "pdf_pages": [
            12,
            43
          ]
        }
      ]
    },
    {
      "id": "sis-common-c-03",
      "course_code": null,
      "name": "創造プロジェクトⅠ",
      "curriculum_area": "faculty_specialized",
      "course_group": "specialized_applied",
      "requirement_code": "C",
      "credits": 2,
      "standard_years": [
        2
      ],
      "terms": [],
      "aliases": [],
      "required_for": [],
      "source_refs": [
        {
          "document_id": "student_handbook_2025",
          "section": "専門応用 C科目（工学科共通・情報電子分野を含む）",
          "printed_pages": [
            8,
            39
          ],
          "pdf_pages": [
            12,
            43
          ]
        }
      ]
    },
    {
      "id": "sis-common-c-04",
      "course_code": null,
      "name": "創造プロジェクトⅡ",
      "curriculum_area": "faculty_specialized",
      "course_group": "specialized_applied",
      "requirement_code": "C",
      "credits": 2,
      "standard_years": [
        2
      ],
      "terms": [],
      "aliases": [],
      "required_for": [],
      "source_refs": [
        {
          "document_id": "student_handbook_2025",
          "section": "専門応用 C科目（工学科共通・情報電子分野を含む）",
          "printed_pages": [
            8,
            39
          ],
          "pdf_pages": [
            12,
            43
          ]
        }
      ]
    },
    {
      "id": "sis-common-c-05",
      "course_code": null,
      "name": "創造研究プロジェクトⅠ",
      "curriculum_area": "faculty_specialized",
      "course_group": "specialized_applied",
      "requirement_code": "C",
      "credits": 2,
      "standard_years": [
        3
      ],
      "terms": [],
      "aliases": [],
      "required_for": [],
      "source_refs": [
        {
          "document_id": "student_handbook_2025",
          "section": "専門応用 C科目（工学科共通・情報電子分野を含む）",
          "printed_pages": [
            8,
            39
          ],
          "pdf_pages": [
            12,
            43
          ]
        }
      ]
    },
    {
      "id": "sis-common-c-06",
      "course_code": null,
      "name": "創造研究プロジェクトⅡ",
      "curriculum_area": "faculty_specialized",
      "course_group": "specialized_applied",
      "requirement_code": "C",
      "credits": 2,
      "standard_years": [
        3
      ],
      "terms": [],
      "aliases": [],
      "required_for": [],
      "source_refs": [
        {
          "document_id": "student_handbook_2025",
          "section": "専門応用 C科目（工学科共通・情報電子分野を含む）",
          "printed_pages": [
            8,
            39
          ],
          "pdf_pages": [
            12,
            43
          ]
        }
      ]
    },
    {
      "id": "sis-common-c-07",
      "course_code": null,
      "name": "マーケット・インターンシップ",
      "curriculum_area": "faculty_specialized",
      "course_group": "specialized_applied",
      "requirement_code": "C",
      "credits": 2,
      "standard_years": [],
      "terms": [],
      "aliases": [],
      "required_for": [],
      "source_refs": [
        {
          "document_id": "student_handbook_2025",
          "section": "専門応用 C科目（工学科共通・情報電子分野を含む）",
          "printed_pages": [
            8,
            39
          ],
          "pdf_pages": [
            12,
            43
          ]
        }
      ]
    },
    {
      "id": "sis-common-c-08",
      "course_code": null,
      "name": "テクノロジー・インターンシップ",
      "curriculum_area": "faculty_specialized",
      "course_group": "specialized_applied",
      "requirement_code": "C",
      "credits": 2,
      "standard_years": [],
      "terms": [],
      "aliases": [],
      "required_for": [],
      "source_refs": [
        {
          "document_id": "student_handbook_2025",
          "section": "専門応用 C科目（工学科共通・情報電子分野を含む）",
          "printed_pages": [
            8,
            39
          ],
          "pdf_pages": [
            12,
            43
          ]
        }
      ]
    },
    {
      "id": "sis-common-c-09",
      "course_code": null,
      "name": "国際工学事情",
      "curriculum_area": "faculty_specialized",
      "course_group": "specialized_applied",
      "requirement_code": "C",
      "credits": 1,
      "standard_years": [],
      "terms": [],
      "aliases": [],
      "required_for": [],
      "source_refs": [
        {
          "document_id": "student_handbook_2025",
          "section": "専門応用 C科目（工学科共通・情報電子分野を含む）",
          "printed_pages": [
            8,
            39
          ],
          "pdf_pages": [
            12,
            43
          ]